[
  {
    "budget_record_id": "bud_8605e7a04ab7f98f",
    "body_id": "lancashire_cc",
    "source_id": "council_local_budget_summary",
    "financial_year": "2021/22",
    "service_name": "Education services",
    "budget_family": "local_revenue_budget",
    "net_budget_gbp": 1020743000,
    "gross_expenditure_gbp": null,
    "income_gbp": null,
    "reserves_gbp": null,
    "council_tax_requirement_gbp": null,
    "data_status": "official",
    "source_url": "https://raw.githubusercontent.com/tompickup23/lancashire/gh-pages/lancashirecc/data/budgets.json",
    "notes": "GOV.UK MHCLG Revenue Outturn (2021/22)"
  },
  {
    "budget_record_id": "bud_ab46ade68f7ab6fe",
    "body_id": "lancashire_cc",
    "source_id": "council_local_budget_summary",
    "financial_year": "2021/22",
    "service_name": "Adult Social Care",
    "budget_family": "local_revenue_budget",
    "net_budget_gbp": 478546000,
    "gross_expenditure_gbp": 654025000,
    "income_gbp": 175479000,
    "reserves_gbp": null,
    "council_tax_requirement_gbp": null,
    "data_status": "official",
    "source_url": "https://raw.githubusercontent.com/tompickup23/lancashire/gh-pages/lancashirecc/data/budgets.json",
    "notes": "GOV.UK MHCLG Revenue Outturn (2021/22)"
  },
  {
    "budget_record_id": "bud_3a2e100f30f3e4a3",
    "body_id": "lancashire_cc",
    "source_id": "council_local_budget_summary",
    "financial_year": "2021/22",
    "service_name": "Children Social Care",
    "budget_family": "local_revenue_budget",
    "net_budget_gbp": 223776000,
    "gross_expenditure_gbp": 226046000,
    "income_gbp": 2270000,
    "reserves_gbp": null,
    "council_tax_requirement_gbp": null,
    "data_status": "official",
    "source_url": "https://raw.githubusercontent.com/tompickup23/lancashire/gh-pages/lancashirecc/data/budgets.json",
    "notes": "GOV.UK MHCLG Revenue Outturn (2021/22)"
  },
  {
    "budget_record_id": "bud_f5c0f4a9707c4c25",
    "body_id": "lancashire_cc",
    "source_id": "council_local_budget_summary",
    "financial_year": "2021/22",
    "service_name": "Public Health",
    "budget_family": "local_revenue_budget",
    "net_budget_gbp": 79041000,
    "gross_expenditure_gbp": 79320000,
    "income_gbp": 279000,
    "reserves_gbp": null,
    "council_tax_requirement_gbp": null,
    "data_status": "official",
    "source_url": "https://raw.githubusercontent.com/tompickup23/lancashire/gh-pages/lancashirecc/data/budgets.json",
    "notes": "GOV.UK MHCLG Revenue Outturn (2021/22)"
  },
  {
    "budget_record_id": "bud_817997602a755881",
    "body_id": "lancashire_cc",
    "source_id": "council_local_budget_summary",
    "financial_year": "2021/22",
    "service_name": "Highways and transport services",
    "budget_family": "local_revenue_budget",
    "net_budget_gbp": 54355000,
    "gross_expenditure_gbp": 102979000,
    "income_gbp": 48624000,
    "reserves_gbp": null,
    "council_tax_requirement_gbp": null,
    "data_status": "official",
    "source_url": "https://raw.githubusercontent.com/tompickup23/lancashire/gh-pages/lancashirecc/data/budgets.json",
    "notes": "GOV.UK MHCLG Revenue Outturn (2021/22)"
  },
  {
    "budget_record_id": "bud_b609c03072b7b591",
    "body_id": "lancashire_cc",
    "source_id": "council_local_budget_summary",
    "financial_year": "2021/22",
    "service_name": "Cultural and related services",
    "budget_family": "local_revenue_budget",
    "net_budget_gbp": 20924000,
    "gross_expenditure_gbp": 22989000,
    "income_gbp": 2065000,
    "reserves_gbp": null,
    "council_tax_requirement_gbp": null,
    "data_status": "official",
    "source_url": "https://raw.githubusercontent.com/tompickup23/lancashire/gh-pages/lancashirecc/data/budgets.json",
    "notes": "GOV.UK MHCLG Revenue Outturn (2021/22)"
  },
  {
    "budget_record_id": "bud_30a1cf497c801f86",
    "body_id": "lancashire_cc",
    "source_id": "council_local_budget_summary",
    "financial_year": "2021/22",
    "service_name": "Environmental and regulatory services",
    "budget_family": "local_revenue_budget",
    "net_budget_gbp": 75484000,
    "gross_expenditure_gbp": 91573000,
    "income_gbp": null,
    "reserves_gbp": null,
    "council_tax_requirement_gbp": null,
    "data_status": "official",
    "source_url": "https://raw.githubusercontent.com/tompickup23/lancashire/gh-pages/lancashirecc/data/budgets.json",
    "notes": "GOV.UK MHCLG Revenue Outturn (2021/22)"
  },
  {
    "budget_record_id": "bud_6248b8256950cf21",
    "body_id": "lancashire_cc",
    "source_id": "council_local_budget_summary",
    "financial_year": "2021/22",
    "service_name": "Central services",
    "budget_family": "local_revenue_budget",
    "net_budget_gbp": 21724000,
    "gross_expenditure_gbp": 140694000,
    "income_gbp": 118970000,
    "reserves_gbp": null,
    "council_tax_requirement_gbp": null,
    "data_status": "official",
    "source_url": "https://raw.githubusercontent.com/tompickup23/lancashire/gh-pages/lancashirecc/data/budgets.json",
    "notes": "GOV.UK MHCLG Revenue Outturn (2021/22)"
  },
  {
    "budget_record_id": "bud_b64d3cc49a5aad3b",
    "body_id": "lancashire_cc",
    "source_id": "council_local_budget_summary",
    "financial_year": "2022/23",
    "service_name": "Education services",
    "budget_family": "local_revenue_budget",
    "net_budget_gbp": 1091478000,
    "gross_expenditure_gbp": null,
    "income_gbp": null,
    "reserves_gbp": null,
    "council_tax_requirement_gbp": null,
    "data_status": "official",
    "source_url": "https://raw.githubusercontent.com/tompickup23/lancashire/gh-pages/lancashirecc/data/budgets.json",
    "notes": "GOV.UK MHCLG Revenue Outturn (2022/23)"
  },
  {
    "budget_record_id": "bud_50253898218a38ae",
    "body_id": "lancashire_cc",
    "source_id": "council_local_budget_summary",
    "financial_year": "2022/23",
    "service_name": "Adult Social Care",
    "budget_family": "local_revenue_budget",
    "net_budget_gbp": 515161000,
    "gross_expenditure_gbp": 703819000,
    "income_gbp": 188658000,
    "reserves_gbp": null,
    "council_tax_requirement_gbp": null,
    "data_status": "official",
    "source_url": "https://raw.githubusercontent.com/tompickup23/lancashire/gh-pages/lancashirecc/data/budgets.json",
    "notes": "GOV.UK MHCLG Revenue Outturn (2022/23)"
  },
  {
    "budget_record_id": "bud_693f543f8097b7eb",
    "body_id": "lancashire_cc",
    "source_id": "council_local_budget_summary",
    "financial_year": "2022/23",
    "service_name": "Children Social Care",
    "budget_family": "local_revenue_budget",
    "net_budget_gbp": 267649000,
    "gross_expenditure_gbp": 269963000,
    "income_gbp": 2314000,
    "reserves_gbp": null,
    "council_tax_requirement_gbp": null,
    "data_status": "official",
    "source_url": "https://raw.githubusercontent.com/tompickup23/lancashire/gh-pages/lancashirecc/data/budgets.json",
    "notes": "GOV.UK MHCLG Revenue Outturn (2022/23)"
  },
  {
    "budget_record_id": "bud_47cd46fd5fdf13b0",
    "body_id": "lancashire_cc",
    "source_id": "council_local_budget_summary",
    "financial_year": "2022/23",
    "service_name": "Public Health",
    "budget_family": "local_revenue_budget",
    "net_budget_gbp": 80052000,
    "gross_expenditure_gbp": 80764000,
    "income_gbp": 712000,
    "reserves_gbp": null,
    "council_tax_requirement_gbp": null,
    "data_status": "official",
    "source_url": "https://raw.githubusercontent.com/tompickup23/lancashire/gh-pages/lancashirecc/data/budgets.json",
    "notes": "GOV.UK MHCLG Revenue Outturn (2022/23)"
  },
  {
    "budget_record_id": "bud_19bcb88e3d18e9ce",
    "body_id": "lancashire_cc",
    "source_id": "council_local_budget_summary",
    "financial_year": "2022/23",
    "service_name": "Highways and transport services",
    "budget_family": "local_revenue_budget",
    "net_budget_gbp": 62163000,
    "gross_expenditure_gbp": 109850000,
    "income_gbp": 47687000,
    "reserves_gbp": null,
    "council_tax_requirement_gbp": null,
    "data_status": "official",
    "source_url": "https://raw.githubusercontent.com/tompickup23/lancashire/gh-pages/lancashirecc/data/budgets.json",
    "notes": "GOV.UK MHCLG Revenue Outturn (2022/23)"
  },
  {
    "budget_record_id": "bud_6d16d847d808c0a0",
    "body_id": "lancashire_cc",
    "source_id": "council_local_budget_summary",
    "financial_year": "2022/23",
    "service_name": "Cultural and related services",
    "budget_family": "local_revenue_budget",
    "net_budget_gbp": 23475000,
    "gross_expenditure_gbp": 26562000,
    "income_gbp": 3087000,
    "reserves_gbp": null,
    "council_tax_requirement_gbp": null,
    "data_status": "official",
    "source_url": "https://raw.githubusercontent.com/tompickup23/lancashire/gh-pages/lancashirecc/data/budgets.json",
    "notes": "GOV.UK MHCLG Revenue Outturn (2022/23)"
  },
  {
    "budget_record_id": "bud_26f4feff790d59c9",
    "body_id": "lancashire_cc",
    "source_id": "council_local_budget_summary",
    "financial_year": "2022/23",
    "service_name": "Environmental and regulatory services",
    "budget_family": "local_revenue_budget",
    "net_budget_gbp": 78256000,
    "gross_expenditure_gbp": 96505000,
    "income_gbp": null,
    "reserves_gbp": null,
    "council_tax_requirement_gbp": null,
    "data_status": "official",
    "source_url": "https://raw.githubusercontent.com/tompickup23/lancashire/gh-pages/lancashirecc/data/budgets.json",
    "notes": "GOV.UK MHCLG Revenue Outturn (2022/23)"
  },
  {
    "budget_record_id": "bud_31f7b64243a0b6b5",
    "body_id": "lancashire_cc",
    "source_id": "council_local_budget_summary",
    "financial_year": "2022/23",
    "service_name": "Central services",
    "budget_family": "local_revenue_budget",
    "net_budget_gbp": 31617000,
    "gross_expenditure_gbp": 156346000,
    "income_gbp": 124729000,
    "reserves_gbp": null,
    "council_tax_requirement_gbp": null,
    "data_status": "official",